place,title,time,pay,date
인천 서구, 반올림피자샵 인천 검단점,12:30~23:30,"시급10,000",24분전
부산 부산진, 반올림피자샵 부산 주례개금점,11:30~23:30,"월급2,600,000",35분전
경기 수원시, 반올림피자샵 수원 광교상현점,11:00~00:00,"시급10,300",47분전
서울 구로구, 반올림피자샵 서울 구로점,14:00~02:00,"시급10,310",47분전
인천 서구, 반올림피자샵 인천 검단점,17:00~23:30,"시급10,000",59분전
경기 시흥시, 반올림피자샵 시흥 정왕점,12:00~24:00,"월급2,600,000",1시간전
경기 시흥시, 반올림피자샵 시흥 정왕점,12:00~24:00,"월급2,600,000",1시간전
경기 시흥시, 반올림피자샵 시흥 정왕점,12:00~24:00,"월급3,000,000",1시간전
충남 아산시, 반올림피자샵 아산 둔포팽성점,17:30~23:30,"시급8,600",1시간전
충남 아산시, 반올림피자샵 아산 둔포팽성점,17:00~23:30,"시급8,600",1시간전
충남 아산시, 반올림피자샵 아산 둔포팽성점,12:00~15:30,"시급8,650",1시간전
충남 천안시, 반올림피자샵 천안 쌍용점,17:00~23:00,"시급15,000",1시간전
충남 천안시, 반올림피자샵 천안 쌍용점,17:00~23:00,"시급15,000",1시간전
서울 금천구, 반올림피자샵 서울 금천구점,12:00~24:00,"월급2,900,000",1시간전
대전 서구, 반올림피자샵 대전 관저도안점,11:00~17:00,"시급10,500",2시간전
대전 서구, 반올림피자샵 대전 관저도안점,11:00~16:00,"시급8,600",2시간전
경북 경산시, 반올림피자샵 경산점,12:00~24:00,"월급2,000,000",2시간전
인천 서구, 반올림피자샵 인천서구점,17:00~24:00,"시급8,700",2시간전
인천 서구, 반올림피자샵 인천서구점,17:00~24:00,"시급8,700",2시간전
인천 서구, 반올림피자샵 인천서구점,17:00~24:00,"시급8,700",2시간전
부산 서구, 반올림피자샵 부산 중서구점,17:30~22:00,"시급9,390",2시간전
인천 부평구, 반올림피자샵 인천 부평1호점,12:00~24:00,"월급2,900,000",2시간전
울산 전체, 반올림피자샵 울산 무거점,18:00~23:30,"시급8,600",2시간전
울산 전체, 반올림피자샵 울산 무거점,18:00~23:30,"시급8,600",2시간전
경기 안산시, 반올림피자샵 안산 사동점,17:30~23:30,"시급8,700",2시간전
경기 안산시, 반올림피자샵 안산 사동점,17:30~23:30,"시급8,700",2시간전
대구 북구, 반올림피자샵 반올림식품,08:00~18:00,"월급2,200,000",2시간전
대구 북구, 반올림피자샵 반올림식품,08:00~18:00,"월급2,200,000",2시간전
경기 김포시, 반올림피자샵 김포 한강신도시점,12:00~24:00,"월급2,400,000",3시간전
경기 수원시, 반올림피자샵 수원 영통점,12:00~24:00,"시급9,000",3시간전
경기 수원시, 반올림피자샵 수원 영통점,12:00~24:00,"시급10,500",3시간전
서울 강남구, 반올림피자샵 서울 강남2호점,11:00~23:00,"월급3,500,000",3시간전
인천 연수구, 반올림피자샵 인천 연수점,11:00~02:00,"시급8,590",3시간전
서울 노원구, 반올림피자샵 서울 하계공릉점,11:50~23:50,"월급2,900,000",4시간전
서울 중랑구, 반올림피자샵 서울 하계공릉점,11:50~23:50,"월급2,900,000",4시간전
인천 연수구, 반올림피자샵 인천 연수점,11:00~02:00,"시급8,590",4시간전
인천 서구, 반올림피자샵 인천 청라연희점,18:00~24:00,"시급10,500",4시간전
인천 서구, 반올림피자샵 인천 청라연희점,18:00~24:00,"시급10,500",4시간전
인천 서구, 반올림피자샵 인천 청라연희점,18:00~24:00,"시급10,500",4시간전
경기 군포시, 반올림피자샵 경기 군포점,12:00~24:00,"시급12,000",4시간전
